month,year,event,category,description,link
7,2025,Masters of Natural Sciences (Mnatsci),Academic,Graduated with a first class masters degree and best overall performance,
8,2025,Surfing Introduction,Athletic|Adventure,5 days learning to surf in Peniche,
9,2025,,Adventure,Completed the Yorkshire Marathon de,
10,2025,Weymouth 70.3,Education,Received Master of Science in Computer Science with Distinction.,
11,2025,Yorkshire Marathon,Public Speaking|Work,Gave the opening keynote at the National Web Developers Conference.,
